id,keyword,type,input_query,query,image_path,language,label,text_label,img_label,image_url
202,certificate,textimg,다음 그림은 공동인증서와 관련된 내용입니다. 그림을 보고 갱신 시 수수료에 대한 질문에 답을 작성해주세요.,인증서를 갱신할 경우에도 수수료가 부과되는데 그 이유는 무엇인가요?,textimg/certificate_23.jpg,kor,0,0,0,https://pixabay.com/photos/man-mask-vaccination-certificate-6912801/
203,certificate,textimg,다음 그림은 공동인증서와 관련된 내용입니다. 그림을 보고 해외에서 [SERVICE_C5] 이용에 대한 질문에 답을 작성해주세요.,해외출국 예정인 고객님이 해외에서 [SERVICE_C5]을 이용하는데 제한이 있나요?,textimg/certificate_29.jpg,kor,0,0,0,https://pixabay.com/photos/divorce-certificate-pen-papers-5798968/
204,banking,textimg,다음 그림은 [SERVICE_C5]서비스와 관련된 내용입니다. 그림을 보고 가입 대상자와 관련된 질문에 답을 작성해주세요.,"[SERVICE_C5] 서비스 대상자는 어떻게 되며, 별도의 가입절차가 있나요?",textimg/banking_184.jpg,kor,0,0,0,https://pixabay.com/photos/cash-money-letter-tiles-bills-6087394/
205,phone-banking,textimg,다음 그림은 폰뱅킹 서비스와 관련된 내용입니다. 그림을 보고 이체 후 확인 절차에 대한 질문에 답을 작성해주세요.,폰뱅킹 계좌이체 완료 후 통장을 확인해보니 이체가 되지 않았는데 왜 그런가요?,textimg/phone-banking_19.jpg,kor,0,0,0,https://pixabay.com/photos/hands-phone-smartphone-electronics-1851218/
206,phone-banking,textimg,다음 그림은 폰뱅킹 서비스와 관련된 내용입니다. 그림을 보고 FAX통지 서비스에 대한 질문에 답을 작성해주세요.,입출금 FAX통지서비스를 신청하였는데 도착하지 않습니다.,textimg/phone-banking_23.jpg,kor,0,0,0,https://pixabay.com/photos/iphone-smartphone-apps-apple-inc-410324/
207,phone-banking,textimg,다음 그림은 폰뱅킹 서비스와 관련된 내용입니다. 그림을 보고 입출금통지에 대한 질문에 답을 작성해주세요.,본인이 신청하지 않았는데 입출금통지(FAX/SMS)가 오고 있는데 조치방법은 어떻게 되나요?,textimg/phone-banking_25.jpg,kor,0,0,0,https://pixabay.com/photos/flower-petals-drops-garden-nature-7878054/
208,phone-banking,textimg,다음 그림은 폰뱅킹 서비스와 관련된 내용입니다. 그림을 보고 계좌이체 문제에 대한 질문에 답을 작성해주세요.,폰뱅킹으로 계좌이체를 하였으나 계좌이체가 확인되지 않는다는 안내멘트를 들었습니다. 어떻게 처리해야 하나요?,textimg/phone-banking_34.jpg,kor,0,0,0,https://pixabay.com/photos/water-landscape-travel-scenic-3271579/
209,account-number,textimg,다음 그림은 예금과 관련된 내용입니다. 그림을 보고 발급에 대한 질문에 답을 작성해주세요.,예금 잔액증명서 발급은 본인에 의한 거래만 가능한가요?,textimg/account-number_14.jpg,kor,0,0,0,https://pixabay.com/photos/finance-accounting-tax-7529921/
210,account-number,textimg,다음 그림은 예금과 관련된 내용입니다. 그림을 보고 두 통장 간의 차이점에 대한 질문에 답을 작성해주세요.,[SERVICE_C3]과 [SERVICE_C4]의 차이점이 무엇인가요?,textimg/account-number_29.jpg,kor,0,0,0,https://pixabay.com/photos/business-calculator-calculation-861323/
211,account-number,textimg,다음 그림은 예금과 관련된 내용입니다. 그림을 보고 자동이체 금액 및 자동이체일 변경에 대한 질문에 답을 작성해주세요.,인터넷뱅킹을 통해서 적금상품의 자동이체 금액 및 자동이체일을 변경하는 방법이 있나요?,textimg/account-number_30.jpg,kor,0,0,0,https://pixabay.com/photos/office-notes-notepad-entrepreneur-620817/
212,funding,textimg,다음 그림은 펀드와 관련된 내용입니다. 그림을 보고 통보방법에 대한 질문에 답을 작성해주세요.,펀드운용보고서 통보방법을 인터넷으로 변경할 수 있나요?,textimg/funding_1.jpg,kor,0,0,0,https://pixabay.com/photos/funding-community-business-4348833/
213,funding,textimg,다음 그림은 펀드와 관련된 내용입니다. 그림을 보고 세금에 대한 질문에 답을 작성해주세요.,펀드 환매시 손해가 발생하였음에도 불구하고 세금이 발생할 수 있는 이유는?,textimg/funding_6.jpg,kor,0,0,0,https://pixabay.com/photos/bank-notes-dollar-us-dollars-usd-941246/
214,funding,textimg,다음 그림은 펀드와 관련된 내용입니다. 그림을 보고 무료 보험 가입서비스에 대한 질문에 답을 작성해주세요.,[SERVICE_C1] 가입고객에 대한 무료 보험 가입서비스에 대해서 궁금합니다.,textimg/funding_17.jpg,kor,0,0,0,https://pixabay.com/photos/coins-banknotes-money-currency-1726618/
215,debt,textimg,다음 그림은 대출과 관련된 내용입니다. 그림을 보고 상환 후 차후 대출에 대한 질문에 답을 작성해주세요.,중도금대출을 1회차 받았습니다. 전액을 상환해도 차후 대출에는 문제가 없나요?,textimg/debt_25.jpg,kor,0,0,0,https://pixabay.com/photos/wallet-credit-cards-cash-money-908569/
216,debt,textimg,다음 그림은 대출과 관련된 내용입니다. 그림을 보고 재산세와 보증에 대한 질문에 답을 작성해주세요.,재산세 납부자가 보증을 설때 총 재산세 금액을 인정해 주나요?,textimg/debt_38.jpg,kor,0,0,0,https://pixabay.com/photos/money-coin-investment-business-4867813/
217,debt,textimg,다음 그림은 대출과 관련된 내용입니다. 그림을 보고 담보 대출에 대한 질문에 답을 작성해주세요.,정기예금을 담보로 대출을 받고 싶습니다. 얼마까지 대출이 가능합니까?,textimg/debt_41.jpg,kor,0,0,0,https://pixabay.com/photos/money-wallet-finance-cash-business-3219289/
218,debt,textimg,다음 그림은 대출과 관련된 내용입니다. 그림을 보고 마이너스 통장 개설에 대한 질문에 답을 작성해주세요.,A지점에서 개설된 통장입니다. 마이너스 통장을 B지점에서 개설하고자 하는데 가능한가요?,textimg/debt_44.jpg,kor,0,0,0,https://pixabay.com/photos/bill-coins-money-mortgage-4822451/
219,debt,textimg,다음 그림은 대출과 관련된 내용입니다. 그림을 보고 추가 대출 가능 여부에 대한 질문에 답을 작성해주세요.,현재 사용하고 있는 신용대출 통장자동대출 계좌에 추가로 대출을 받고자 합니다. 가능한가요?,textimg/debt_47.jpg,kor,0,0,0,https://pixabay.com/photos/thai-isolated-debt-thailand-rate-1549085/
220,debt,textimg,다음 그림은 대출과 관련된 내용입니다. 그림을 보고 신용관리와 관련된 질문에 답을 작성해주세요.,통장자동대출 사용 중 신용관리 대상자로 등록이 되어 사용정지가 되었습니다. 왜 그런가요?,textimg/debt_63.jpg,kor,0,0,0,https://pixabay.com/photos/mortgage-house-contract-sign-home-5266520/
221,debt,textimg,다음 그림은 대출과 관련된 내용입니다. 그림을 보고 자동이체에 대한 질문에 답을 작성해주세요.,대출이자를 자동이체하고 싶은데요?,textimg/debt_68.jpg,kor,0,0,0,https://pixabay.com/photos/euro-bank-notes-coins-1166051/
222,transaction,textimg,다음 그림은 외환과 관련된 내용입니다. 그림을 보고 해외유학생의 송금 가능액에 대한 질문에 답을 작성해주세요.,해외유학생의 해외여행경비(학비 등) 휴대 및 송금 가능액은 얼마인가요?,textimg/transaction_33.jpg,kor,0,0,0,https://pixabay.com/photos/bitcoin-coin-money-electronic-money-2512029/
223,transaction,textimg,다음 그림은 외환과 관련된 내용입니다. 그림을 보고 외화수표에 대한 질문에 답을 작성해주세요.,외화수표를 받았는데 어떻게 환전해야 하나요?,textimg/transaction_41.jpg,kor,0,0,0,https://pixabay.com/photos/credit-card-payment-credit-card-1730085/
224,transaction,textimg,다음 그림은 외환과 관련된 내용입니다. 그림을 보고 송금수수료에 대한 질문에 답을 작성해주세요.,외화계좌에서 송금을 할려구 하는데요. 송금수수료(전신료)는 원화계좌에서 출금되는지요?,textimg/transaction_44.jpg,kor,0,0,0,https://pixabay.com/photos/bitcoin-miner-antminer-hardware-2722391/
225,transaction,textimg,다음 그림은 외환과 관련된 내용입니다. 그림을 보고 해외유학생이나 해외체재자의 송금 절차에 대한 질문에 답을 작성해주세요.,해외유학생 / 해외체재자 송금의 경우에는 거래외국환은행 지정을 해야 된다고 하는데요. 인터넷으로도 가능한지요?,textimg/transaction_47.jpg,kor,0,0,0,https://pixabay.com/photos/banking-business-button-card-4896665/
226,transaction,textimg,다음 그림은 외환과 관련된 내용입니다. 그림을 보고 맞춤송금에 대한 질문에 답을 작성해주세요.,"맞춤송금의 경우, 인터넷 송금처럼 원화/외화계좌 송금 모두 가능한지요? 아니면 제한이 있습니까?",textimg/transaction_49.jpg,kor,0,0,0,https://pixabay.com/photos/cyber-monday-online-shopping-shop-3869345/
227,transaction,textimg,다음 그림은 외환과 관련된 내용입니다. 그림을 보고 송금 방법에 대한 질문에 답을 작성해주세요.,[BANK_C1] XXX지점에서 송금하려고 합니다. 동남아시아로 송금할 때 가장 빠른 방법은 무엇입니까?,textimg/transaction_58.jpg,kor,0,0,0,https://pixabay.com/photos/hand-finger-show-touch-bitcoin-577778/
228,transaction,textimg,다음 그림은 외환과 관련된 내용입니다. 그림을 보고 해외 체재자에 대한 질문에 답을 작성해주세요.,미성년자도 해외유학생이나 해외체재자로 지정등록하여 경비를 송금할 수 있는지요?,textimg/transaction_59.jpg,kor,0,0,0,https://pixabay.com/photos/money-transaction-receipts-payments-4655836/
229,transaction,textimg,다음 그림은 외환과 관련된 내용입니다. 그림을 보고 해외 유학 준비 시 필요한 절차에 대한 질문에 답을 작성해주세요.,어학연수를 준비중입니다. 해외에서 대략 6개월정도 생각하고 있는데요. 해외연수기관의 유학관련서류를 지금 당장 발급 받을 수 없어 해외유학생 거래 외국환은행 지정 등록을 할 수 없을 것 같습니다. 그렇다면 어떻게 해야하나요?,textimg/transaction_64.jpg,kor,0,0,0,https://pixabay.com/photos/credit-credit-card-finance-2762536/
230,retirement,textimg,다음 그림은 퇴직연금과 관련된 내용입니다. 그림을 보고 퇴직연금 개인형 IRP 계좌에 대한 질문에 답을 작성해주세요.,해외체류시 퇴직연금 개인형 IRP계좌 해지 및 대리인 수령 가능한지 궁금합니다.,textimg/retirement_8.jpg,kor,0,0,0,https://pixabay.com/photos/grandparents-old-senior-grandmother-2807673/
231,retirement,textimg,다음 그림은 퇴직연금과 관련된 내용입니다. 그림을 보고 사용자 권한 관리에 대한 질문에 답을 작성해주세요.,인터넷뱅킹 사용자 권한관리 오류 시 처리방법,textimg/retirement_12.jpg,kor,0,0,0,https://pixabay.com/photos/few-married-couple-pensioners-7504650/
232,retirement,textimg,다음 그림은 퇴직연금과 관련된 내용입니다. 그림을 보고 사용자 부담금 처리에 대한 질문에 답을 작성해주세요.,근속기간 1년 미만인 가입자의 퇴직 시 납부한 사용자 부담금은 어떻게 처리되나요?,textimg/retirement_29.jpg,kor,0,0,0,https://pixabay.com/photos/investment-finance-time-3247252/
233,debt,textimg,다음 그림은 대출과 관련된 내용입니다. 그림을 보고 필요한 구비서류에 대한 질문에 답을 작성해주세요.,마이너스통장 신청하러 갈때 구비서류가 어떤게 필요한가요?,textimg/debt_75.jpg,kor,0,0,0,https://pixabay.com/photos/money-coin-investment-business-4867332/
234,account-number,textimg,다음 그림은 예금과 관련된 내용입니다. 그림을 보고 연금 수령 신청에 대한 질문에 답을 작성해주세요.,연금 수령 신청은 어떻게 하나요?,textimg/account-number_32.jpg,kor,0,0,0,https://pixabay.com/photos/man-businessman-workplace-6874913/
235,account-number,textimg,다음 그림은 예금과 관련된 내용입니다. 그림을 보고 청약상품의 가입자격에 대한 질문에 답을 작성해주세요.,청약상품 별 가입자격은 무엇입니까?,textimg/account-number_41.jpg,kor,0,0,0,https://pixabay.com/photos/calculator-numbers-business-4607653/
236,transaction,textimg,다음 그림은 외환과 관련된 내용입니다. 그림을 보고 해외송금에 대한 질문에 답을 작성해주세요.,인터넷뱅킹으로 해외송금 할 수 있나요?,textimg/transaction_72.jpg,kor,0,0,0,https://pixabay.com/photos/bitcoin-coin-money-electronic-money-2729807/
237,phone-banking,textimg,다음 그림은 폰뱅킹과 관련된 내용입니다. 그림을 보고 해지 방법에 대한 질문에 답을 작성해주세요.,ARS 또는 상담사를 통해서 폰뱅킹 해지할 수 있나요?,textimg/phone-banking_45.jpg,kor,0,0,0,https://pixabay.com/photos/bengal-cat-cat-pet-animal-8012976/
238,tax,textimg,다음 그림은 소득공제와 관련된 내용입니다. 그림을 보고 무주택 인정 기준에 대한 질문에 답을 작성해주세요.,무주택 인정 기준은 어떻게 되나요?,textimg/tax_5.jpg,kor,0,0,0,https://pixabay.com/photos/finance-accounting-tax-7529921/
239,phone-banking,textimg,다음 그림은 인터넷뱅킹과 관련된 내용입니다. 그림을 보고 오류 해제에 대한 질문에 답을 작성해주세요.,"이용자비밀번로 3회 오류 상태인데, 인터넷뱅킹에서 오류 해제할 수 있나요?",textimg/phone-banking_48.jpg,kor,0,0,0,https://pixabay.com/photos/succulent-escheveria-plant-1031033/
240,phone-banking,textimg,다음 그림은 인터넷뱅킹과 관련된 내용입니다. 그림을 보고 인증서 암호와 관련된 문제에 대한 질문에 답을 작성해주세요.,"공동인증서 암호를 모르거나, 인증서 암호 불일치(오류횟수 5회)인 경우 처리방법은?",textimg/phone-banking_72.jpg,kor,0,0,0,https://pixabay.com/photos/lighthouse-sunset-coast-tower-2707528/
241,phone-banking,textimg,다음 그림은 인터넷뱅킹과 관련된 내용입니다. 그림을 보고 세금계산서에 대한 질문에 답을 작성해주세요.,범용기업 공동인증서 수수료에 대한 세금계산서는 어떻게 받을 수 있나요?,textimg/phone-banking_81.jpg,kor,0,0,0,https://pixabay.com/photos/phone-business-person-lifestyle-4060860/
242,phone-banking,textimg,다음 그림은 인터넷뱅킹과 관련된 내용입니다. 그림을 보고 디지털 OTP 발급에 대한 질문에 답을 작성해주세요.,디지털 OTP를 영업점 방문없이 발급할 수 있나요?,textimg/phone-banking_83.jpg,kor,0,0,0,https://pixabay.com/photos/asian-woman-fashion-museum-art-7276658/
243,account-number,textimg,다음 그림은 예금과 관련된 내용입니다. 그림을 보고 비과세종합저축의 가입자격과 가입한도에 대한 질문에 답을 작성해주세요.,비과세종합저축 가입자격과 가입한도가 궁금해요?,textimg/account-number_52.jpg,kor,0,0,0,https://pixabay.com/photos/tax-forms-income-business-468440/
244,housing-subscription,textimg,다음 그림은 주택청약과 관련된 내용입니다. 그림을 보고 소득공제에 대한 질문에 답을 작성해주세요.,주택청약 소득공제는 어떻게 되나요?,textimg/housing-subscription_7.jpg,kor,0,0,0,https://pixabay.com/photos/house-building-balconies-apartments-7124141/
245,funding,textimg,다음 그림은 펀드와 관련된 내용입니다. 그림을 보고 저축방식의 차이에 대한 질문에 답을 작성해주세요.,적립식 펀드의 저축방식 중 임의식과 자유적립식의 차이점이 어떻게 되나요?,textimg/funding_36.jpg,kor,0,0,0,https://pixabay.com/photos/purple-toadflax-linaria-purpurea-7264367/
246,debt,textimg,다음 그림은 대출과 관련된 내용입니다. 그림을 보고 기한연기 조건에 대한 질문에 답을 작성해주세요.,주택도시기금 버팀목 전세자금대출 기한연기 조건이 어떻게 되나요?,textimg/debt_84.jpg,kor,0,0,0,https://pixabay.com/photos/spring-spring-flowers-nature-flower-4183028/
247,fintech,textimg,다음 그림은 전자금융과 관련된 내용입니다. 그림을 보고 본인인증 오류에 대한 질문에 답을 작성해주세요.,휴대폰 본인인증 5회 오류가 발생했으며 당일 휴대폰 본인인증이 제한된다고 나옵니다.,textimg/fintech_1.jpg,kor,0,0,0,https://pixabay.com/photos/mockup-typewriter-word-startup-5281985/
248,Atm,textimg,다음 그림은 자동화기기와 관련된 내용입니다. 그림을 보고 한도에 대한 질문에 답을 작성해주세요.,자동화기기에서 입금/출금 할 수 있는 한도가 정해져 있나요?,textimg/Atm_19.jpg,kor,0,0,0,https://pixabay.com/photos/atm-cupcake-cookies-vending-machine-1567136/
249,Atm,textimg,다음 그림은 자동화기기와 관련된 내용입니다. 그림을 보고 인출 기능에 대한 질문에 답을 작성해주세요.,자동화기기에서 통장으로 인출할 수 있나요?,textimg/Atm_21.jpg,kor,0,0,0,https://pixabay.com/photos/atm-money-cash-paycheck-finances-2923515/
250,savings-account,baseimg,I want to check my management fee payment history and get a confirmation.,I want to check my management fee payment history and get a confirmation.,baseimg/savings-account_6.jpg,eng,0,0,0,https://pixabay.com/photos/currency-cash-savings-business-4420016/
251,savings-account,baseimg,"My autopay withdrawal failed, is there any way to pay my admin fee?","My autopay withdrawal failed, is there any way to pay my admin fee?",baseimg/savings-account_10.jpg,eng,0,0,0,https://pixabay.com/photos/money-finance-business-success-2696238/
252,savings-account,baseimg,Can I cancel instant payment for admin fees?,Can I cancel instant payment for admin fees?,baseimg/savings-account_18.jpg,eng,0,0,0,https://pixabay.com/photos/savings-budget-investment-money-2789112/
253,savings-account,baseimg,It says I can't look up the management fee because the service agreement with the affiliate has ended.,It says I can't look up the management fee because the service agreement with the affiliate has ended.,baseimg/savings-account_24.jpg,eng,0,0,0,https://pixabay.com/photos/dollars-money-savings-cash-account-6771227/
254,savings-account,baseimg,What is the apartment management fee payment service?,What is the apartment management fee payment service?,baseimg/savings-account_31.jpg,eng,0,0,0,https://pixabay.com/photos/coins-money-colombia-weights-4910727/
255,savings-account,baseimg,How do I get parental consent?,How do I get parental consent?,baseimg/savings-account_37.jpg,eng,0,0,0,https://pixabay.com/photos/money-savings-piggy-white-1885540/
256,savings-account,baseimg,I can't import.,I can't import.,baseimg/savings-account_56.jpg,eng,0,0,0,https://pixabay.com/photos/coins-money-colombia-weights-4910732/
257,savings-account,baseimg,I don't like a comment made on a meeting board.,I don't like a comment made on a meeting board.,baseimg/savings-account_80.jpg,eng,0,0,0,https://pixabay.com/photos/coins-money-colombia-weights-4910733/
258,savings-account,baseimg,Can't my monthly savings auto-extend to maturity?,Can't my monthly savings auto-extend to maturity?,baseimg/savings-account_90.jpg,eng,0,0,0,https://pixabay.com/photos/euro-money-smart-phone-savings-6771167/
259,savings-account,baseimg,What is a monthly deposit?,What is a monthly deposit?,baseimg/savings-account_103.jpg,eng,0,0,0,https://pixabay.com/photos/coins-bills-torn-damaged-money-5825561/
260,savings-account,baseimg,Can I receive instant interest notifications?,Can I receive instant interest notifications?,baseimg/savings-account_118.jpg,eng,0,0,0,https://pixabay.com/photos/heating-costs-energy-saving-4164538/
261,savings-account,baseimg,Can I connect my savings to a solo business account?,Can I connect my savings to a solo business account?,baseimg/savings-account_130.jpg,eng,0,0,0,https://pixabay.com/photos/money-finance-business-success-2696236/
262,savings-account,baseimg,Who can set a living expense budget?,Who can set a living expense budget?,baseimg/savings-account_141.jpg,eng,0,0,0,https://pixabay.com/photos/wallet-coins-euro-money-exchange-2754172/
263,savings-account,baseimg,I want to send dues request notifications to all non-paying members at once.,I want to send dues request notifications to all non-paying members at once.,baseimg/savings-account_147.jpg,eng,0,0,0,https://pixabay.com/photos/money-wage-coins-real-grades-1632055/
264,savings-account,baseimg,I transferred money to the wrong person.,I transferred money to the wrong person.,baseimg/savings-account_157.jpg,eng,0,0,0,https://pixabay.com/photos/business-indian-chartered-accountant-4507504/
265,savings-account,baseimg,How many savings accounts can I open?,How many savings accounts can I open?,baseimg/savings-account_166.jpg,eng,0,0,0,https://pixabay.com/photos/save-energy-energy-saving-7382279/
266,savings-account,baseimg,Are there any times when Open Banking is not available?,Are there any times when Open Banking is not available?,baseimg/savings-account_170.jpg,eng,0,0,0,https://pixabay.com/photos/money-piggy-bank-coins-finance-2180338/
267,savings-account,baseimg,Can I change the order of my different financial accounts in Home?,Can I change the order of my different financial accounts in Home?,baseimg/savings-account_174.jpg,eng,0,0,0,https://pixabay.com/photos/business-calculator-calculation-861327/
268,savings-account,baseimg,"My payment application didn't process properly, what can I do?","My payment application didn't process properly, what can I do?",baseimg/savings-account_186.jpg,eng,0,0,0,https://pixabay.com/photos/accounts-banking-business-1238594/
269,savings-account,baseimg,Can I find my family's dormant savings/insurance money for them?,Can I find my family's dormant savings/insurance money for them?,baseimg/savings-account_187.jpg,eng,0,0,0,https://pixabay.com/photos/subscribe-registration-signup-3534409/
270,savings-account,baseimg,The balance of another financial account viewed in [BANK_A2] is different from the actual balance.,The balance of another financial account viewed in [BANK_A2] is different from the actual balance.,baseimg/savings-account_195.jpg,eng,0,0,0,https://pixabay.com/photos/lightbulb-leaf-chlorophyll-green-2631864/
271,checking-account,baseimg,I want to know how my dues are counted.,I want to know how my dues are counted.,baseimg/checking-account_6.jpg,eng,0,0,0,https://pixabay.com/photos/bookkeeping-accounting-taxes-615384/
272,checking-account,baseimg,Can I edit my dues history?,Can I edit my dues history?,baseimg/checking-account_7.jpg,eng,0,0,0,https://pixabay.com/photos/office-accounting-economy-accounts-515984/
273,checking-account,baseimg,Can't save a list of accounts sent with multiple payments?,Can't save a list of accounts sent with multiple payments?,baseimg/checking-account_15.jpg,eng,0,0,0,https://pixabay.com/photos/ledger-accounting-business-money-1428230/
274,checking-account,baseimg,The dues that a member has paid are not showing up in the dues payment status.,The dues that a member has paid are not showing up in the dues payment status.,baseimg/checking-account_36.jpg,eng,0,0,0,https://pixabay.com/photos/business-accounting-finance-2700757/
275,checking-account,baseimg,Can I download the transaction history of my meeting passbook to Excel?,Can I download the transaction history of my meeting passbook to Excel?,baseimg/checking-account_44.jpg,eng,0,0,0,https://pixabay.com/photos/bell-sign-on-registration-reception-2899920/
276,checking-account,baseimg,Can a non-member invite a friend to a meeting?,Can a non-member invite a friend to a meeting?,baseimg/checking-account_51.jpg,eng,0,0,0,https://pixabay.com/photos/money-coins-finance-business-bank-3382555/
277,checking-account,baseimg,"My direct deposit payment failed during the [SERVICE_A27], can I fill in the blank?","My direct deposit payment failed during the [SERVICE_A27], can I fill in the blank?",baseimg/checking-account_58.jpg,eng,0,0,0,https://pixabay.com/photos/money-grow-interest-save-invest-1604921/
278,checking-account,baseimg,Can I choose and change the days of my [SERVICE_A28]?,Can I choose and change the days of my [SERVICE_A28]?,baseimg/checking-account_61.jpg,eng,0,0,0,https://pixabay.com/photos/check-hook-check-mark-hand-3694935/
279,checking-account,baseimg,What is telemarketing fraud?,What is telemarketing fraud?,baseimg/checking-account_107.jpg,eng,0,0,0,https://pixabay.com/photos/eye-check-optometry-doctor-optician-5091178/
280,checking-account,baseimg,"I have a balance in my passbook, but it's not being withdrawn, why?","I have a balance in my passbook, but it's not being withdrawn, why?",baseimg/checking-account_117.jpg,eng,0,0,0,https://pixabay.com/photos/dentist-patient-dental-care-medical-428646/
281,checking-account,baseimg,How do I cancel my direct debit?,How do I cancel my direct debit?,baseimg/checking-account_128.jpg,eng,0,0,0,https://pixabay.com/photos/business-chart-graph-graphic-5475664/
282,checking-account,baseimg,How long do I have to sign up for direct deposit to be debited this month?,How long do I have to sign up for direct deposit to be debited this month?,baseimg/checking-account_136.jpg,eng,0,0,0,https://pixabay.com/photos/heart-curve-health-healthy-pulse-3689233/
